"ID","COPYRIGHT_ID","NAME","COPYRIGHT","TERMS_OF_USE","URL"
"1681","PsoSat","Psoriasis Satisfaction Questionnaire (PsoSat)","Copyright © 2016 Matthias Augustin.","Used with permission.",""
"1685","FRAX","Fracture Risk Assessment (FRAX)","Copyright © 2008 Eugene McCloskey.","Used with permission.",""
"1703","Keele_SBST","University of Keele, STarT Back Screening Tool (SBST)","Copyright © 2007 University of Keele.","Used with permission.","https://www.keele.ac.uk/sbst/legal/"
"1704","Duke-AD","Duke University - Duke Anxiety-Depression Scale","Copyright © 1994 Department of Community and Family Medicine, Duke University Medical Center, Durham, NC, USA.","Used with permission.","https://cfm.duke.edu/research/duke-health-measures"
"1707","Webster_Opioid","Lynn Webster, MD","© 2018 Dr. Lynn Webster","Used with permission",""
"1709","NPUAP_Push","National Pressure Ulcer Advisory Panel","Copyright © 1998 National Pressure Ulcer Advisory Panel","Used with permission. It is understood that the name of the instrument and the indication that the copyright belongs to the National Pressure Ulcer Advisory Panel remain on any copies and that you do not make any changes to the wording or scoring of this tool.","www.npuap.org"
"1710","NPUAP_2016","National Pressure Ulcer Advisory Panel","Copyright © 2016 National Pressure Ulcer Advisory Panel","Used with permission. It is understood that the name of the instrument and the indication that the copyright belongs to the National Pressure Ulcer Advisory Panel remain on any copies and that you do not make any changes to the wording or scoring of this tool.","www.npuap.org"
"1716","RAND","RAND Health Care","Copyright © the RAND Corporation.","RAND's permission to reproduce the survey is not an endorsement of the products, services, or other uses in which the survey appears or is applied.","https://www.rand.org/health-care"
"1717","MFQ","Mood and Feelings Questionnaires (MFQ)","Copyright © Adrian Angold & Elizabeth J. Costello, 1987; Developmental Epidemiology Program; Duke University.","Used with permission.","http://devepi.duhs.duke.edu/mfq.html"
"1718","NACHC_PRAPARE","National Association of Community Health Centers","© 2019. This item comes from the national PRAPARE social determinants of health assessment protocol, developed and owned by the National Association of Community Health Centers (NACHC), in partnership with the Association of Asian Pacific Community Health Organization (AAPCHO), the Oregon Primary Care Association (OPCA), and the Institute for Alternative Futures (IAF). For more information, visit www.nachc.org/prapare","Used with permission.","www.nachc.org"
